[
  {
    "ID":"SALES123",
    "businessCreationDate":"2015-07-26T15:42:16Z",
    "callOff":false,
    "confirmedDeliveryDate":{
      "from":"2016-02-11",
      "till":"2016-02-15"
    },
    "creatorPerson":{
      "ID":"100",
      "firstName":"Frits",
      "familyName":"Spits"
    },
    "customer":{
      "ID":"12481",
      "callSign":"Loomans"
    },
    "customerOrderReference":"SALES4875",
    "fuelSurcharge": true,
    "internalComment":"This is my internal comment",
    "entity":{
      "ID":"124",
      "callSign":"Company Distribution"
    },
    "reactiveSalesPerson":{
      "ID":"71948",
      "firstName":"Tom",
      "familyName":"Aat"
    },
    "rejectionReason": {
      "ID":"12345",
      "description": "Wrong Data",
      "comment":"This order was rejected because the wrong sales person was entered"
    },
    "requestedDeliveryDate":{
      "from":"2016-01-15",
      "till":"2016-02-29"
    },
    "salesPerson":{
      "ID":"201591",
      "firstName":"Peter",
      "familyName":"Seli"
    },
    "status":"Rejected",
    "systemCreationDate":"2016-01-07T10:22:57Z",
    "version":1
  }
]